{
  "schema": "ucc.report",
  "schema_version": 1,
  "id": "rpt_01K0A6R4V8W6E3M4M8Y0R9J2QP",
  "created_at": "2026-08-22T12:05:00.000Z",
  "created_by": "act_01K0A6R4V8W6E3M4M8Y0R9J2QA",
  "record_version": 1,
  "execution_id": "exec_01K0A6R4V8W6E3M4M8Y0R9J2QE",
  "node_id": "node_01K0A6R4V8W6E3M4M8Y0R9J2QX",
  "report_type": "execution_summary",
  "summary": "Execution completed with exit code 0",
  "details": {
    "exit_code": 0,
    "duration_ms": 4200
  }
}
